### DISCUSSION TITLE
Syslog do not seem to be getting to Filebeat

### DISCUSSION THREAD

**Discussion by stevewillia** [Security-Onion-Solutions/securityonion#3036] [Unsupported Versions]
so 2.3.21
ubuntu 18.04

Trying to track down why the logs are not being processed.  I've setup custom Logstash shipper and created my pipeline etc...

But it does not look like syslog make it to Filebeat.

I've done the following

Firewall looks correct

iptables -L | grep syslog
ACCEPT udp -- anywhere 172.17.0.14 udp dpt:syslog
ACCEPT udp -- _gateway anywhere udp dpt:syslog
ACCEPT udp -- securityonion anywhere udp dpt:syslog

I created a tcpdump for docker and looked for syslog traffic at Filebeat and nothing. I know the firewall is sending the logs. I checked with ngrep port syslog.

docker run --tty --net=container:so-filebeat tcpdump tcpdump -N -A -v 'udp port 514'
tcpdump: listening on eth0, link-type EN10MB (Ethernet), capture size 262144 bytes

0 packets captured
0 packets received by filter
0 packets dropped by kernel

and I checked Filebeat sending logs to Elasticsearch

docker run --tty --net=container:so-filebeat tcpdump tcpdump -N -A -v 'tcp port 5644'
14:47:09.420948 IP (tos 0x0, ttl 64, id 63996, offset 0, flags [DF], proto TCP (6), length 52)
    kawvalley.5644 > so-filebeat.35140: Flags [.], cksum 0xd1ea (incorrect -> 0x1912), ack 4074, win 4304, options [nop,nop,TS val 4104047137 ecr 132339567], length 0
E..4..@.@.o...d........DY.ul.>.\...........
...!..Wo
14:47:09.430960 IP (tos 0x0, ttl 64, id 63997, offset 0, flags [DF], proto TCP (6), length 87)
    kawvalley.5644 > so-filebeat.35140: Flags [P.], cksum 0xd20d (incorrect -> 0xef8c), seq 36:71, ack 4074, win 4304, options [nop,nop,TS val 4104047147 ecr 132339567], length 35
E..W..@.@.n...d........DY.ul.>.\...........
...+..Wo...............10.y.....
..y..U..Y.
14:47:09.430972 IP (tos 0x0, ttl 64, id 34964, offset 0, flags [DF], proto TCP (6), length 52)
    so-filebeat.35140 > kawvalley.5644: Flags [.], cksum 0xd1ea (incorrect -> 0x27b6), ack 71, win 501, options [nop,nop,TS val 132339577 ecr 4104047147], length 0
E..4..@.@..k......d..D...>.\Y.u............
..Wy...+

7 packets captured
7 packets received by filter
0 packets dropped by kernel

So I know tcpdump is working

Any help would be appreciated.
Steve

**Comment by TOoSmOotH** [comment]
What does the filebeat and logtash logs say?

**Reply by stevewillia** [reply]
Normal

[2021-02-19T19:44:41,306][INFO ][logstash.outputs.elasticsearch] Installing elasticsearch template to _template/so-import
[2021-02-19T19:44:41,337][INFO ][logstash.javapipeline    ] Starting pipeline {:pipeline_id=>"search", "pipeline.workers"=>2, "pipeline.batch.size"=>125, "pipeline.batch.delay"=>50, "pipeline.max_inflight"=>250, "pipeline.sources"=>["/usr/share/logstash/pipelines/search/0900_input_redis.conf", "/usr/share/logstash/pipelines/search/9000_output_zeek.conf", "/usr/share/logstash/pipelines/search/9002_output_import.conf", "/usr/share/logstash/pipelines/search/9034_output_syslog.conf", "/usr/share/logstash/pipelines/search/9100_output_osquery.conf", "/usr/share/logstash/pipelines/search/9400_output_suricata.conf", "/usr/share/logstash/pipelines/search/9500_output_beats.conf", "/usr/share/logstash/pipelines/search/9600_output_ossec.conf", "/usr/share/logstash/pipelines/search/9700_output_strelka.conf", "/usr/share/logstash/pipelines/search/9999_sonicwall"], :thread=>"#<Thread:0x229fdd31 run>"}
[2021-02-19T19:44:42,202][INFO ][logstash.javapipeline    ] Pipeline Java execution initialization time {"seconds"=>0.86}
[2021-02-19T19:44:42,237][INFO ][logstash.inputs.redis    ] Registering Redis {:identity=>"redis://@kawvalley:9696/0 list:logstash:unparsed"}
[2021-02-19T19:44:42,262][INFO ][logstash.javapipeline    ] Pipeline started {"pipeline.id"=>"search"}
[2021-02-19T19:44:42,449][INFO ][logstash.javapipeline    ] Pipeline started {"pipeline.id"=>"manager"}
[2021-02-19T19:44:42,608][INFO ][logstash.agent           ] Pipelines running {:count=>2, :running_pipelines=>[:manager, :search], :non_running_pipelines=>[]}
[2021-02-19T19:44:42,619][INFO ][org.logstash.beats.Server] Starting server on port: 5644
[2021-02-19T19:44:42,621][INFO ][org.logstash.beats.Server] Starting server on port: 5044
[2021-02-19T19:44:43,195][INFO ][logstash.agent           ] Successfully started Logstash API endpoint {:port=>9600}


the errors in Filebeat are due to restarting Logstash yesterday

44: read: connection reset by peer
2021-02-19T19:42:58.638Z	ERROR	[publisher_pipeline_output]	pipeline/output.go:154	Failed to connect to backoff(async(tcp://kawvalley:5644)): EOF
2021-02-19T19:43:36.464Z	ERROR	[logstash]	logstash/async.go:280	Failed to publish events caused by: EOF
2021-02-19T19:43:36.472Z	ERROR	[logstash]	logstash/async.go:280	Failed to publish events caused by: client is not connected
2021-02-19T19:43:38.219Z	ERROR	[publisher_pipeline_output]	pipeline/output.go:180	failed to publish events: client is not connected
2021-02-19T19:43:41.110Z	ERROR	[publisher_pipeline_output]	pipeline/output.go:154	Failed to connect to backoff(async(tcp://kawvalley:5644)): EOF
2021-02-19T19:43:48.064Z	ERROR	[publisher_pipeline_output]	pipeline/output.go:154	Failed to connect to backoff(async(tcp://kawvalley:5644)): dial tcp 192.168.100.252:5644: connect: connection refused
2021-02-19T19:44:00.356Z	ERROR	[publisher_pipeline_output]	pipeline/output.go:154	Failed to connect to backoff(async(tcp://kawvalley:5644)): dial tcp 192.168.100.252:5644: connect: connection refused
2021-02-19T19:44:22.328Z	ERROR	[publisher_pipeline_output]	pipeline/output.go:154	Failed to connect to backoff(async(tcp://kawvalley:5644)): read tcp 172.17.0.14:50120->192.168.100.252:5644: read: connection reset by peer
2021-02-19T19:45:04.582Z	ERROR	[publisher_pipeline_output]	pipeline/output.go:154	Failed to connect to backoff(async(tcp://kawvalley:5644)): EOF

**Comment by stevewillia** [comment]
If I use nectar and send a test syslog message like

echo "<134>  id=firewall sn=C0EAE4EAEB50" | nc -v -u -w 0 securityonion 514

The message gets to Filebeat

docker run --tty --net=container:so-filebeat tcpdump tcpdump -N -A -v 'udp port 514'
tcpdump: listening on eth0, link-type EN10MB (Ethernet), capture size 262144 bytes
20:17:09.876696 IP (tos 0x0, ttl 64, id 15075, offset 0, flags [DF], proto UDP (17), length 29)
    kawvalley.40847 > so-filebeat.514: [|syslog]
E...:.@.@..)..d..........	..X
20:17:09.876726 IP (tos 0x0, ttl 64, id 15076, offset 0, flags [DF], proto UDP (17), length 29)
    kawvalley.40847 > so-filebeat.514: [|syslog]
E...:.@.@..(..d..........	..X
20:17:09.876799 IP (tos 0x0, ttl 64, id 15077, offset 0, flags [DF], proto UDP (17), length 63)
    kawvalley.40847 > so-filebeat.514: SYSLOG, length: 35
	Facility local0 (16), Severity info (6)
	Msg:   id=firewall sn=C0EAE4EAEB50\0x0a
E..?:.@.@.....d..........+..<134>  id=firewall sn=C0EAE4EAEB50


Looks like iptables may be the issue.

I'll keep looking

**Comment by TOoSmOotH** [comment]
Did you run so-allow and allow the ip from the device you are sending from?

**Reply by stevewillia** [reply]
Yes. I's the _gateway

iptables -L | grep syslog
ACCEPT udp -- anywhere 172.17.0.14 udp dpt:syslog
ACCEPT udp -- _gateway anywhere udp dpt:syslog
ACCEPT udp -- securityonion anywhere udp dpt:syslog
