### ISSUE TITLE
Truenas forward syslog to standalone node not being registered

### ISSUE THREAD

**Issue by ghost** [Security-Onion-Solutions/securityonion#14626]
Hello,

Trying to setup syslog forward from Truenas to Standalone SO Server.

Truenas setup :

![Image](https://github.com/user-attachments/assets/8900d1f8-68a2-4422-ba2b-173a83990686)

Added : Administration --> Configuration --> firewall -->hosgroups-->syslog-->range of approved IP 192.168.X.X/XX

SO Server using : sudo tcpdump -i any port 514

I can see traffic : 

listening on any, link-type LINUX_SLL2 (Linux cooked v2), snapshot length 262144 bytes
14:41:43.300424 eno1  In  IP FS02.SHEDMTL.LOCAL.syslog > srv-securityonion.shedmtl.local.syslog: SYSLOG daemon.notice, length: 109
14:41:43.300425 eno1  In  IP FS02.SHEDMTL.LOCAL.syslog > srv-securityonion.shedmtl.local.syslog: SYSLOG daemon.notice, length: 108
14:41:43.300426 eno1  In  IP FS02.SHEDMTL.LOCAL.syslog > srv-securityonion.shedmtl.local.syslog: SYSLOG daemon.notice, length: 115
14:41:43.300426 eno1  In  IP FS02.SHEDMTL.LOCAL.syslog > srv-securityonion.shedmtl.local.syslog: SYSLOG daemon.notice, length: 108
14:41:43.300426 eno1  In  IP FS02.SHEDMTL.LOCAL.syslog > srv-securityonion.shedmtl.local.syslog: SYSLOG daemon.notice, length: 117
14:41:43.300427 eno1  In  IP FS02.SHEDMTL.LOCAL.syslog > srv-securityonion.shedmtl.local.syslog: SYSLOG daemon.notice, length: 108

BUT it is not being logged in the SO / Kibana.

Any idea why it's not being logged ?

**Comment by ghost** [comment]
Seems it started to work after 2h of it enabled...
