### DISCUSSION TITLE
All HIDS agents stopped communicating with the manager

### DISCUSSION THREAD

**Discussion by xxvs** [Security-Onion-Solutions/securityonion#8043] [Unsupported Versions]
Distributed setup - 1 manager node and 1 heavy node

The heavy node had working agents connected to it, and all of a sudden the logs stopped showing up in SOC.
There were no network changes.
I can see the connection attempts with tcpdump:

```
[root@host]# tcpdump -i eth0 udp port 1514
tcpdump: verbose output suppressed, use -v or -vv for full protocol decode
listening on eth0, link-type EN10MB (Ethernet), capture size 262144 bytes
09:13:44.847141 IP 10.179.15.140.51857 > HEAVY_NODE_IP: UDP, length 85
09:13:45.545622 IP 10.179.15.138.58215 > HEAVY_NODE_IP: UDP, length 85
09:13:45.782637 IP 10.179.15.137.42893 > HEAVY_NODE_IP: UDP, length 85
09:13:45.843894 IP 10.179.15.144.12913 > HEAVY_NODE_IP: UDP, length 85
09:13:46.300355 IP 10.179.15.134.60208 > HEAVY_NODE_IP: UDP, length 85
09:13:46.345904 IP 10.179.15.145.33668 > HEAVY_NODE_IP: UDP, length 85
09:13:46.933522 IP 10.179.15.135.16492 > HEAVY_NODE_IP: UDP, length 85
09:13:47.506585 IP 10.179.11.97.42924 > HEAVY_NODE_IP: UDP, length 85
09:13:49.468533 IP 10.179.15.136.38161 > HEAVY_NODE_IP: UDP, length 85
09:13:49.865108 IP 10.179.15.140.51858 > HEAVY_NODE_IP: UDP, length 85
09:13:50.562730 IP 10.179.15.138.58216 > HEAVY_NODE_IP: UDP, length 85
09:13:50.784391 IP 10.179.15.137.56375 > HEAVY_NODE_IP: UDP, length 85
09:13:50.851312 IP 10.179.15.144.45688 > HEAVY_NODE_IP: UDP, length 85
09:13:50.927775 IP 10.179.15.133.57076 > HEAVY_NODE_IP: UDP, length 85
09:13:51.315850 IP 10.179.15.134.60209 > HEAVY_NODE_IP: UDP, length 85
09:13:51.349787 IP 10.179.15.145.52894 > HEAVY_NODE_IP: UDP, length 85
09:13:51.940901 IP 10.179.15.135.21354 > HEAVY_NODE_IP: UDP, length 85
09:13:52.509382 IP 10.179.11.97.39725 > HEAVY_NODE_IP: UDP, length 85
```

All of the IPs on the left are agent IPs. 
The agents show the typical "trying to connect" logs
```
2022/05/31 11:21:13 ossec-agentd: INFO: Trying to connect to server (HEAVY_NODE_IP:1514/udp).
2022/05/31 11:21:18 ossec-agentd: INFO: Closing connection to server (HEAVY_NODE_IP:1514/udp).
```

**Comment by dougburks** [comment]
Have you verified that the proper firewall rules are still in place?
```
sudo iptables -nvL |grep 1514
```

**Reply by xxvs** [reply]
Yes, all the rules are in place.

**Reply by dougburks** [reply]
Have you checked the Wazuh server logs in `/nsm/wazuh/`?
