### DISCUSSION TITLE
Syslog empty fresh install 2.3.61

### DISCUSSION THREAD

**Discussion by djeronimo** [Security-Onion-Solutions/securityonion#5127] [Unsupported Versions]
I have a SecOnion 16.04 in production and it's been working great for a number of years.  I am setting up version 2.3.61 atm as a manager node.  I am trying to send syslogs from my PaloAlto firewall to 2.3.61 but kibana show no data.  I get an error "No matching indices found: No indices match pattern "*:so-*".  I ran so-allow and added syslog to the firewall.  I can see the traffic running tcpdump, but nothing shows up in kibana.

netstat is showing that 514 is listening.

tcp6       0      0 :::514                  :::*                    LISTEN      -
tcp6       0      0 :::1514                 :::*                    LISTEN      -
udp6       0      0 :::514                  :::*                                -
udp6       0      0 :::1514                 :::*                                -

tcpdump show this

tcpdump: verbose output suppressed, use -v or -vv for full protocol decode
listening on docker0, link-type EN10MB (Ethernet), capture size 262144 bytes
11:24:41.042078 IP 172.17.0.17.shell > PA-3320-Dent124-1.45242: Flags [.], ack 1334264080, win 0, options [nop,nop,TS val 477504 ecr 616106909], length 0
11:24:41.042530 IP PA-3320-Dent124-1.45242 > 172.17.0.17.shell: Flags [.], ack 1, win 115, options [nop,nop,TS val 616108413 ecr 419932], length 0
11:24:56.081469 IP 172.17.0.17.shell > PA-3320-Dent124-1.45242: Flags [.], ack 1, win 0, options [nop,nop,TS val 492544 ecr 616108413], length 0
11:24:56.082562 IP PA-3320-Dent124-145242 > 172.17.0.17.shell: Flags [.], ack 1, win 115, options [nop,nop,TS val 616109917 ecr 419932], length 0
11:25:01.734394 IP 192.168.112.12.syslog > 172.17.0.17.syslog: SYSLOG user.warning, length: 91

/opt/so/log/filebeat/filebeat.log

][WARN ][logstash.outputs.redis   ] Failed to flush outgoing items {:outgoing_count=>125, :exception=>"Redis::CommandError", :backtrace=>["/usr/share/logstash/vendor/bundle/jruby/2.5.0/gems/redis-4.3.1/lib/redis/client.rb:147:in `call'", "/usr/share/logstash/vendor/bundle/jruby/2.5.0/gems/redis-4.3.1/lib/redis.rb:1160:in `block in rpush'", "/usr/share/logstash/vendor/bundle/jruby/2.5.0/gems/redis-4.3.1/lib/redis.rb:70:in `block in synchronize'", "uri:classloader:/META-INF/jruby.home/lib/ruby/stdlib/monitor.rb:237:in `block in mon_synchronize'", "org/jruby/RubyThread.java:759:in `handle_interrupt'", "uri:classloader:/META-INF/jruby.home/lib/ruby/stdlib/monitor.rb:236:in `block in mon_synchronize'", "org/jruby/RubyThread.java:759:in `handle_interrupt'", "uri:classloader:/META-INF/jruby.home/lib/ruby/stdlib/monitor.rb:233:in `mon_synchronize'", "/usr/share/logstash/vendor/bundle/jruby/2.5.0/gems/redis-4.3.1/lib/redis.rb:70:in `synchronize'", "/usr/share/logstash/vendor/bundle/jruby/2.5.0/gems/redis-4.3.1/lib/redis.rb:1159:in `rpush'", "/usr/share/logstash/vendor/bundle/jruby/2.5.0/gems/logstash-output-redis-5.0.0/lib/logstash/outputs/redis.rb:152:in `flush'", "/usr/share/logstash/vendor/bundle/jruby/2.5.0/gems/stud-0.0.23/lib/stud/buffer.rb:221:in `block in buffer_flush'", "org/jruby/RubyHash.java:1415:in `each'", "/usr/share/logstash/vendor/bundle/jruby/2.5.0/gems/stud-0.0.23/lib/stud/buffer.rb:216:in `buffer_flush'", "/usr/share/logstash/vendor/bundle/jruby/2.5.0/gems/stud-0.0.23/lib/stud/buffer.rb:159:in `buffer_receive'", "/usr/share/logstash/vendor/bundle/jruby/2.5.0/gems/logstash-output-redis-5.0.0/lib/logstash/outputs/redis.rb:209:in `send_to_redis'", "/usr/share/logstash/vendor/bundle/jruby/2.5.0/gems/logstash-codec-json-3.0.5/lib/logstash/codecs/json.rb:42:in `encode'", "/usr/share/logstash/logstash-core/lib/logstash/codecs/delegator.rb:48:in `block in encode'", "org/logstash/instrument/metrics/AbstractSimpleMetricExt.java:65:in `time'", "org/logstash/instrument/metrics/AbstractNamespacedMetricExt.java:64:in `time'", "/usr/share/logstash/logstash-core/lib/logstash/codecs/delegator.rb:47:in `encode'", "/usr/share/logstash/vendor/bundle/jruby/2.5.0/gems/logstash-output-redis-5.0.0/lib/logstash/outputs/redis.rb:123:in `receive'", "/usr/share/logstash/logstash-core/lib/logstash/outputs/base.rb:105:in `block in multi_receive'", "org/jruby/RubyArray.java:1809:in `each'", "/usr/share/logstash/logstash-core/lib/logstash/outputs/base.rb:105:in `multi_receive'", "org/logstash/config/ir/compiler/OutputStrategyExt.java:143:in `multi_receive'", "org/logstash/config/ir/compiler/AbstractOutputDelegatorExt.java:121:in `multi_receive'", "/usr/share/logstash/logstash-core/lib/logstash/java_pipeline.rb:295:in `block in start_workers'"]}
[2021-08-16T19:09:57,496][WARN ][logstash.outputs.redis   ] Failed to send backlog of events to Redis {:identity=>"redis://@srvseconion2:6379/0 list:logstash:unparsed", :exception=>#<Redis::CommandError: OOM command not allowed when used memory > 'maxmemory'.>, :backtrace=>["/usr/share/logstash/vendor/bundle/jruby/2.5.0/gems/redis-4.3.1/lib/redis/client.rb:147:in `call'", "/usr/share/logstash/vendor/bundle/jruby/2.5.0/gems/redis-4.3.1/lib/redis.rb:1160:in `block in rpush'", "/usr/share/logstash/vendor/bundle/jruby/2.5.0/gems/redis-4.3.1/lib/redis.rb:70:in `block in synchronize'", "uri:classloader:/META-INF/jruby.home/lib/ruby/stdlib/monitor.rb:237:in `block in mon_synchronize'", "org/jruby/RubyThread.java:759:in `handle_interrupt'", "uri:classloader:/META-INF/jruby.home/lib/ruby/stdlib/monitor.rb:236:in `block in mon_synchronize'", "org/jruby/RubyThread.java:759:in `handle_interrupt'", "uri:classloader:/META-INF/jruby.home/lib/ruby/stdlib/monitor.rb:233:in `mon_synchronize'", "/usr/share/logstash/vendor/bundle/jruby/2.5.0/gems/redis-4.3.1/lib/redis.rb:70:in `synchronize'", "/usr/share/logstash/vendor/bundle/jruby/2.5.0/gems/redis-4.3.1/lib/redis.rb:1159:in `rpush'", "/usr/share/logstash/vendor/bundle/jruby/2.5.0/gems/logstash-output-redis-5.0.0/lib/logstash/outputs/redis.rb:152:in `flush'", "/usr/share/logstash/vendor/bundle/jruby/2.5.0/gems/stud-0.0.23/lib/stud/buffer.rb:221:in `block in buffer_flush'", "org/jruby/RubyHash.java:1415:in `each'", "/usr/share/logstash/vendor/bundle/jruby/2.5.0/gems/stud-0.0.23/lib/stud/buffer.rb:216:in `buffer_flush'", "/usr/share/logstash/vendor/bundle/jruby/2.5.0/gems/stud-0.0.23/lib/stud/buffer.rb:159:in `buffer_receive'", "/usr/share/logstash/vendor/bundle/jruby/2.5.0/gems/logstash-output-redis-5.0.0/lib/logstash/outputs/redis.rb:209:in `send_to_redis'", "/usr/share/logstash/vendor/bundle/jruby/2.5.0/gems/logstash-codec-json-3.0.5/lib/logstash/codecs/json.rb:42:in `encode'", "/usr/share/logstash/logstash-core/lib/logstash/codecs/delegator.rb:48:in `block in encode'", "org/logstash/instrument/metrics/AbstractSimpleMetricExt.java:65:in `time'", "org/logstash/instrument/metrics/AbstractNamespacedMetricExt.java:64:in `time'", "/usr/share/logstash/logstash-core/lib/logstash/codecs/delegator.rb:47:in `encode'", "/usr/share/logstash/vendor/bundle/jruby/2.5.0/gems/logstash-output-redis-5.0.0/lib/logstash/outputs/redis.rb:123:in `receive'", "/usr/share/logstash/logstash-core/lib/logstash/outputs/base.rb:105:in `block in multi_receive'", "org/jruby/RubyArray.java:1809:in `each'", "/usr/share/logstash/logstash-core/lib/logstash/outputs/base.rb:105:in `multi_receive'", "org/logstash/config/ir/compiler/OutputStrategyExt.java:143:in `multi_receive'", "org/logstash/config/ir/compiler/AbstractOutputDelegatorExt.java:121:in `multi_receive'", "/usr/share/logstash/logstash-core/lib/logstash/java_pipeline.rb:295:in `block in start_workers'"]}

Any help would be great.

Danny

**Comment by weslambert** [comment]
Looks like you might first need to increase maxmemory for Redis:

https://docs.securityonion.net/en/latest/redis.html?highlight=redis#tuning

**Reply by djeronimo** [reply]
Thanks for the reply @weslambert.  I took a look at the doc and I noticed that when I stop logstash, the redis server queue does not empty.  I have increased the maxmemory on the global.sls for the redis server to 4GB, restarted and no change.  Still getting No matching indices found: No indices match pattern "*:so-*" when I open up kibana.  No data showing in any of the datasets in kibana.
