### DISCUSSION TITLE
Unable to  enable Checkpoint Module

### DISCUSSION THREAD

**Discussion by Phillip-Samson** [Security-Onion-Solutions/securityonion#6607] [Unsupported Versions] [answered]
Version:  2.3.90
On prem
ISO install
Standalone
OK,
After reading some of the other comments I see that I am not the only person having this issue so..
Firstly, it looks as though the Netflow documentation regarding opening up the firewall port in the Filebeat Docker  container is redundant 
(Or i am completely missing something which is probably the case)
according to https://github.com/Security-Onion-Solutions/securityonion/discussions/6591#discussioncomment-1822641

So after I removed the reference in the Filebeaty init.sls file and left the reference in the minion file I was able to get past the firewall issue I was having, which is to say that salt will not throw errors when starting Filebeat

However,
Once I was past the firewall issues, I now get a different error and the Filebeat container simply crashes

![image](https://user-images.githubusercontent.com/36277967/146441764-09f974bb-218c-4a51-99af-7fd637629071.png)

I have been working on this for days and after trying to follow the documentation and trying to piece this together from the discussions i finally found the Netflow video on youtube which I thought was going to show me the way but alas. I'm still no closer than i was a week ago
I have followed the Netflow documentation and added the firewall rules as well as enabled the pipeline the container shows that it is listening on the proper port.

I have tried removing the velociraptor stanza all together however that doe not help..

What am I missing?????

sudo docker ps | grep so-filebeat
standaloneserver:5000/security-onion-solutions/so-filebeat:2.3.90             "/usr/local/bin/dock…"   50 minutes ago   Up 50 minutes         0.0.0.0:514->514/tcp, 0.0.0.0:5066->5066/tcp, 0.0.0.0:514->514/udp                                         so-filebeat
Please let me know if there are there any other logs I could provide to help solve this issue. 
Guidance would be greatly appreciated

Minion.sls
filebeat:
  third_party_filebeat:
    modules:
      checkpoint:
        firewall:
          enabled: true
          var.input: udp
          var.syslog_host: 0.0.0.0
          var.syslog_port: 9505
    inputs:
      - type: log
        paths:
          - /velociraptor/Custom.Flows.Write/*.json
        fields:
          module: velociraptor
          pipeline: velociraptor
        processors:
          - drop_fields:
              fields: '["source", "prospector", "input", "offset", "beat"]'
        fields_under_root: true
        clean_removed: false
        close_removed: false
        
firewall:
  assigned_hostgroups:
    chain:
      DOCKER-USER:
        hostgroups:
          velociraptor:
            portgroups:
              - portgroups.velociraptor
          checkpoint:
            portgroups:
              - portgroups.checkpoint
          f5:
            portgroups:
              - portgroups.f5
      INPUT:
        hostgroups:     
          checkpoint:
            portgroups:
              - portgroups.checkpoint
          f5:
            portgroups:
              - portgroups.f5

**Comment by weslambert** [comment]
Could you please provide a copy of your latest config, ensuring to use the markdown function within Discussions so that you can reference indentation within the config?

**Comment by Phillip-Samson** [comment]
```
host:
  mainint: 'em1'
sensoroni:
  node_address: 'xxx.xxx.xxx.xxx'
  node_description: ''

sensor:
  interface: 'bond0'
  mainip: 'xxx.xxx.xxx.xxx'
  mainint: 'em1'
  zeek_lbprocs: 5
  suriprocs: 5
  manager: ''
  mtu: 1500
  uniqueid: 1631732281
  hnsensor: 
steno:
  enabled: True
patch:
  os:
    source: 'direct'
    schedule_name: 'auto'
    enabled: True
    splay: 300

manager:
  mainip: 'xxx.xxx.xxx.xxx'
  mainint: 'em1'
  proxy: ''
  no_proxy: ''
  esheap: '25000m'
  esclustername: '{{ grains.host }}'
  freq: 0
  domainstats: 0
  mtu: 1500
  elastalert: 1
  es_port: 9200
  cur_close_days: 30
  grafana: 1
  osquery: 1
  thehive: 1
  playbook: 1

elasticsearch:
  mainip: 'xxx.xxx.xxx.xxx'
  mainint: 'em1'
  esheap: '25000m'
  esclustername: '{{ grains.host }}'
  node_type: ''
  es_port: 9200
  log_size_limit: 46
  node_route_type: 'hot'

logstash_settings:
  ls_pipeline_batch_size: 125
  ls_input_threads: 1
  lsheap: 1000m
  ls_pipeline_workers: 24

idstools:
  config:
    ruleset: 'ETOPEN'
    oinkcode: ''
    urls:
  sids:
    enabled:
    disabled:
    modify:

kratos:
  kratoskey: 'xxxxxxxxxxxxxxxxxxxx'

filebeat:
  third_party_filebeat:
    modules:
      checkpoint:
        firewall:
          enabled: true
          var.input: udp
          var.syslog_host: 0.0.0.0
          var.syslog_port: 9505
    inputs:
      - type: log
        paths:
          - /velociraptor/Custom.Flows.Write/*.json
        fields:
          module: velociraptor
          pipeline: velociraptor
        processors:
          - drop_fields:
              fields: '["source", "prospector", "input", "offset", "beat"]'
        fields_under_root: true
        clean_removed: false
        close_removed: false
        
firewall:
  assigned_hostgroups:
    chain:
      DOCKER-USER:
        hostgroups:
          velociraptor:
            portgroups:
              - portgroups.velociraptor
          checkpoint:
            portgroups:
              - portgroups.checkpoint
          f5:
            portgroups:
              - portgroups.f5
      INPUT:
        hostgroups:     
          checkpoint:
            portgroups:
              - portgroups.checkpoint
          f5:
            portgroups:
              - portgroups.f5         
```

**Comment by weslambert** [comment]
Looking at this more, it looks like you need to specify your input type as `syslog`, or leave it out, since it is the default:

https://github.com/elastic/beats/blob/master/x-pack/filebeat/modules.d/checkpoint.yml.disabled#L8-L9

For example:

```
filebeat:
  third_party_filebeat:
    modules:
      checkpoint:
        firewall:
          enabled: true
          var.syslog_host: 0.0.0.0
          var.syslog_port: 9505
```

I just tried adding this to the pillar, then restarted Filebeat, and did not experience an error.

**Comment by Phillip-Samson** [comment]
Thank you, Wes! The Filebeat container does stay up now that I removed the var.input udp. I knew I was making a mistake somewhere!

Only thing is that even though the container stays up and the port is open within the container, the index is not being generated and populated.

filebeart log
```
2021-12-16T19:45:36.445Z	INFO	beater/filebeat.go:117	Enabled modules/filesets: checkpoint (firewall)
2021-12-16T19:45:36.448Z	INFO	[esclientleg]	eslegclient/connection.go:100	elasticsearch url: https://xxxxxxxxxxx:9200
2021-12-16T19:45:36.468Z	INFO	[esclientleg]	eslegclient/connection.go:273	Attempting to connect to Elasticsearch version 7.15.2
2021-12-16T19:45:36.591Z	INFO	[modules]	fileset/pipelines.go:133	Elasticsearch pipeline loaded.	{"pipeline": "filebeat-7.15.2-checkpoint-firewall-pipeline"}

```

filebeat.log
```
2021-12-22T14:37:54.704Z	WARN	[cfgwarn]	tlscommon/config.go:100	DEPRECATED: Treating the CommonName field on X.509 certificates as a host name when no Subject Alternative Names are present is going to be removed. Please update your certificates if needed. Will be removed in version: 8.0.0
2021-12-22T14:37:54.709Z	WARN	beater/filebeat.go:178	Filebeat is unable to load the Ingest Node pipelines for the configured modules because the Elasticsearch output is not configured/enabled. If you have already loaded the Ingest Node pipelines or are using Logstash pipelines, you can ignore this warning.
2021-12-22T14:37:54.986Z	WARN	beater/filebeat.go:381	Filebeat is unable to load the Ingest Node pipelines for the configured modules because the Elasticsearch output is not configured/enabled. If you have already loaded the Ingest Node pipelines or are using Logstash pipelines, you can ignore this warning.
2021-12-22T14:37:55.161Z	WARN	[cfgwarn]	registered_domain/registered_domain.go:61	BETA: The registered_domain processor is beta.
2021-12-22T14:37:55.161Z	WARN	[cfgwarn]	registered_domain/registered_domain.go:61	BETA: The registered_domain processor is beta.
2021-12-22T14:37:55.161Z	WARN	[cfgwarn]	registered_domain/registered_domain.go:61	BETA: The registered_domain processor is beta.
2021-12-22T14:37:55.161Z	WARN	[cfgwarn]	registered_domain/registered_domain.go:61	BETA: The registered_domain processor is beta.
2021-12-22T14:37:55.161Z	WARN	[cfgwarn]	registered_domain/registered_domain.go:61	BETA: The registered_domain processor is beta.
2021-12-22T14:37:55.161Z	WARN	[cfgwarn]	registered_domain/registered_domain.go:61	BETA: The registered_domain processor is beta.
```

**Reply by weslambert** [reply]
You can use `so-elasticsearch-pipeline-stats` to see if events have been processed through a particular ingest node pipeline.  You can use `so-elasticsearch-pipelines-list` to find the name of the ingest node pipeline, and ensure it is loaded. I would also double-check to ensure that the port is accessible externally.

**Reply by tomjones1977** [reply]
Did you add the logstash pipelines after you enabled the input? 

`sudo docker exec -i so-filebeat filebeat setup modules -pipelines -modules checkpoint -c /usr/share/filebeat/module-setup.yml`

Reference: https://docs.securityonion.net/en/2.3/filebeat.html

**Comment by Phillip-Samson** [comment]


**Reply by tomjones1977** [reply]
That `tcpdump` output doesn't look quite right.  Are you seeing the UDP traffic being passed to the container IP?  `iptables` should be forwarding the packets to the container so you should see each packet twice, try changing your interface to `-i any` to capture all the traffic.

That would at least confirm that the packets are getting to the container.  After that it would be a case of checking the container logs - you may need to enable DEBUG mode on the Filebeat container to see what's going on.

**Reply by Phillip-Samson** [reply]
```
tcpdump -i any port 9505
tcpdump: verbose output suppressed, use -v or -vv for full protocol decode
listening on any, link-type LINUX_SLL (Linux cooked), capture size 262144 bytes
14:15:55.509078 IP fw1-internal.random.com.41617 > securityonion.ipa.random.com.9505: UDP, length 828
14:15:55.509114 IP fw1-internal.random.com.41617 > 172.17.0.22.9505: UDP, length 828
14:15:55.509119 IP fw1-internal.random.com.41617 > 172.17.0.22.9505: UDP, length 828
14:15:55.509123 IP fw1-internal.random.com.41617 > securityonion.ipa.random.com.9505: UDP, length 853
14:15:55.509135 IP fw1-internal.random.com.41617 > 172.17.0.22.9505: UDP, length 853
14:15:55.509137 IP fw1-internal.random.com.41617 > 172.17.0.22.9505: UDP, length 853
14:15:55.509139 IP fw1-internal.random.com.41617 > securityonion.ipa.random.com.9505: UDP, length 861
14:15:55.509144 IP fw1-internal.random.com.41617 > 172.17.0.22.9505: UDP, length 861
14:15:55.509146 IP fw1-internal.random.com.41617 > 172.17.0.22.9505: UDP, length 861
14:15:55.509148 IP fw1-internal.random.com.41617 > securityonion.ipa.random.com.9505: UDP, length 861
14:15:55.509152 IP fw1-internal.random.com.41617 > 172.17.0.22.9505: UDP, length 861
14:15:55.509155 IP fw1-internal.random.com.41617 > 172.17.0.22.9505: UDP, length 861
14:15:55.509157 IP fw1-internal.random.com.41617 > securityonion.ipa.random.com.9505: UDP, length 826
14:15:55.509161 IP fw1-internal.random.com.41617 > 172.17.0.22.9505: UDP, length 826
14:15:55.509163 IP fw1-internal.random.com.41617 > 172.17.0.22.9505: UDP, length 826
^C
15 packets captured
1949 packets received by filter
1888 packets dropped by kernel

```
assigned_hostgroups.local.map.yaml
```
role:
  eval:
    velociraptor:
            portgroups:
              - {{ portgroups.velociraptor }}
  fleet:
  heavynode:
  helixsensor:
  import:
  manager:
    velociraptor:
            portgroups:
              - {{ portgroups.velociraptor }}
  managersearch:
    velociraptor:
            portgroups:
              - {{ portgroups.velociraptor }}
  standalone:
    velociraptor:
            portgroups:
              - {{ portgroups.velociraptor }}
```
portgroups.local.yaml
```
firewall:
  aliases:
    ports:
      checkpoint:
        tcp: ['9505']
        udp: ['9505']
      f5:
        tcp: ['9504']
        udp: ['9504']
      velociraptor:
        tcp: [8000, 8001, 8889]
```
hostgroups.local.yaml does have checkpoint defined

```
iptables --list | grep 9505
ACCEPT     udp  --  mypc.random.com  anywhere             udp dpt:9505
ACCEPT     tcp  --  mypc.random.com  anywhere             tcp dpt:9505
ACCEPT     udp  --  fw1-internal.random.com  anywhere             udp dpt:9505
ACCEPT     tcp  --  fw1-internal.random.com  anywhere             tcp dpt:9505
ACCEPT     tcp  --  anywhere             172.17.0.22          tcp dpt:9505
ACCEPT     udp  --  anywhere             172.17.0.22          udp dpt:9505
ACCEPT     udp  --  mypc.random.com  anywhere             udp dpt:9505
ACCEPT     tcp  --  mypc.random.com  anywhere             tcp dpt:9505
ACCEPT     udp  --  fw1-internal.random.com  anywhere             udp dpt:9505
ACCEPT     tcp  --  fw1-internal.random.com  anywhere             tcp dpt:9505
```
filebeat container IP is 172.17.0.22
```
docker container inspect so-filebeat | grep -i IPAddress
            "SecondaryIPAddresses": null,
            "IPAddress": "172.17.0.22",
                    "IPAddress": "172.17.0.22"
```

Interesting note:
When I try and nc -u to port 9505 on the SO server I get  connected
```
[Expert@fw1-internal:0]# nc -u -vv securityonion.domain.com 9505
t
test
---------------------------------------------------------------------------------------------
tcpdump -i any port 9505
tcpdump: verbose output suppressed, use -v or -vv for full protocol decode
listening on any, link-type LINUX_SLL (Linux cooked), capture size 262144 bytes
14:53:43.419593 IP fw1-internal.random.com.51556 > securityonion.random.com.9505: UDP, length 2
14:53:43.419665 IP fw1-internal.random.com.51556 > 172.17.0.22.9505: UDP, length 2
14:53:43.419672 IP fw1-internal.random.com.51556 > 172.17.0.22.9505: UDP, length 2
14:53:54.976544 IP fw1-internal.random.com.51556 > securityonion.random.com.9505: UDP, length 5
14:53:54.976590 IP fw1-internal.random.com.51556 > 172.17.0.22.9505: UDP, length 5
14:53:54.976596 IP fw1-internal.random.com.51556 > 172.17.0.22.9505: UDP, length 5

```

Once I turned on debug, I can see that the data is being sent to filebeat however still nothing in the index and completely unsearchable in Kabana
```
2021-12-28T15:27:22.169Z	DEBUG	[processors]	processing/processors.go:203	Publish event: {
  "@timestamp": "2021-12-28T15:27:22.168Z",
  "@metadata": {
    "beat": "filebeat",
    "type": "_doc",
    "version": "7.15.2",
    "truncated": false,
    "pipeline": "filebeat-7.15.2-checkpoint-firewall-pipeline"
  },
  "tags": [
    "checkpoint-firewall",
    "forwarded"
  ],
  "event": {
    "module": "checkpoint",
    "dataset": "checkpoint.firewall",
    "timezone": "+00:00"
  },
  "fileset": {
    "name": "firewall"
  },
  "ecs": {
    "version": "1.11.0"
  },
  "agent": {
    "type": "filebeat",
    "version": "7.15.2",
    "hostname": "so-filebeat",
    "ephemeral_id": "19b587be-f99d-46ce-b5c1-",
    "id": "eab8bb03-993a-48e0-adc9-",
    "name": "securityonion"
  },
  "message": "<134>1 2021-12-28T15:27:20Z fw1-internal CheckPoint 12921 - [action:\"Drop\"; flags:\"395524\"; ifdir:\"inbound\"; ifname:\"bond1.700\"; logid:\"0\"; loguid:\"{0x61cb2cd9,0x1c,0xf5fc14ac,}\"; origin:\"xxx.xxx.xxx.xxx\"; originsicname:\"CN=fire-xx,O=cpmodule..qk69yy\"; sequencenum:\"522\"; time:\"1640705240\"; version:\"5\"; __policy_id_tag:\"product=VPN-1 & FireWall-1[db_tag={35F9FBE6-BB92-B742-85A6-44869B2B567A};mgmt=cpmodule;date=1640273295;policy_name=xxx\\]\"; dst:\"xxx.xxx.xxx.xxx\"; inzone:\"External\"; layer_name:\"Network\"; layer_uuid:\"7d608b5e-4425-4784-9554\"; match_id:\"xxx\"; parent_rule:\"0\"; rule_action:\"Drop\"; rule_uid:\"9779a0a2-1fda-4fe1\"; outzone:\"External\"; product:\"VPN-1 & FireWall-1\"; proto:\"6\"; s_port:\"44713\"; service:\"6435\"; service_id:\"rulenames\"; src:\"xxx.xxx.xxx.xxx\"]\n",
  "log": {
    "source": {
      "address": "172.xxx.xxx.xxx:51822"
    }
  },
  "service": {
    "type": "checkpoint"
  },
  "input": {
    "type": "udp"
  }
}
```

**Comment by Phillip-Samson** [comment]
After I ran Soup today to see if that would fix the issue I noticed that the checkpoint module did not start up so I re-ran 
```
sudo docker exec -i so-filebeat filebeat setup modules -pipelines -modules checkpoint -c /usr/share/filebeat/module-setup.yml
```
Then I noticed in the debug logs the following warning
```
2022-01-04T15:31:07.727Z	INFO	beater/filebeat.go:118	Enabled modules/filesets: checkpoint (firewall)
2022-01-04T15:31:07.727Z	WARN	beater/filebeat.go:136	Fileset `firewall` for module `checkpoint` is loaded but was not explicitly defined in the config. Starting from v8.0 this fileset won't be loaded unless explicitly defined.
2022-01-04T15:31:07.728Z	INFO	[esclientleg]	eslegclient/connection.go:102	elasticsearch url: https://securityonion:9200
2022-01-04T15:31:07.753Z	INFO	[esclientleg]	eslegclient/connection.go:282	Attempting to connect to Elasticsearch version 7.16.2
2022-01-04T15:31:07.767Z	INFO	[modules]	fileset/pipelines.go:133	Elasticsearch pipeline loaded.	{"pipeline": "filebeat-7.16.2-checkpoint-firewall-pipeline"}
```
Am I missing something in a config?
```
2022-01-04T15:31:07.727Z	WARN	beater/filebeat.go:136	Fileset `firewall` for module `checkpoint` is loaded but was not explicitly defined in the config. Starting from v8.0 this fileset won't be loaded unless explicitly defined.
```


I alsio am seeing these errors

```
2022-01-02T20:27:04.951Z	ERROR	[logstash]	logstash/async.go:280	Failed to publish events caused by: write tcp 172.17.0.22:35616->172.xx.xxxx.xxx5:5644: write: broken pipe
2022-01-02T20:27:06.248Z	ERROR	[publisher_pipeline_output]	pipeline/output.go:180	failed to publish events: write tcp 172.17.0.22:35616->172.xx.xxxx.xxx5:5644: write: broken pipe
2022-01-02T20:27:09.578Z	ERROR	[publisher_pipeline_output]	pipeline/output.go:154	Failed to connect to backoff(async(tcp://securityonion:5644)): read tcp 172.17.0.22:37300->172.xx.xxxx.xxx5:5644: read: connection reset by peer
2022-01-02T20:27:15.360Z	ERROR	[publisher_pipeline_output]	pipeline/output.go:154	Failed to connect to backoff(async(tcp://securityonion:5644)): read tcp 172.17.0.22:37324->172.xx.xxxx.xxx5:5644: read: connection reset by peer
2022-01-02T20:27:26.924Z	ERROR	[publisher_pipeline_output]	pipeline/output.go:154	Failed to connect to backoff(async(tcp://securityonion:5644)): read tcp 172.17.0.22:37358->172.xx.xxxx.xxx5:5644: read: connection reset by peer
2022-01-02T20:27:48.451Z	ERROR	[publisher_pipeline_output]	pipeline/output.go:154	Failed to connect to backoff(async(tcp://securityonion:5644)): read tcp 172.17.0.22:37522->172.xx.xxxx.xxx5:5644: read: connection reset by peer
2022-01-04T14:21:21.702Z	ERROR	[logstash]	logstash/async.go:280	Failed to publish events caused by: write tcp 172.17.0.22:37922->172.xx.xxxx.xxx5:5644: write: broken pipe
2022-01-04T14:21:22.846Z	ERROR	[publisher_pipeline_output]	pipeline/output.go:180	failed to publish events: write tcp 172.17.0.22:37922->172.xx.xxxx.xxx5:5644: write: broken pipe
2022-01-04T14:21:26.186Z	ERROR	[publisher_pipeline_output]	pipeline/output.go:154	Failed to connect to backoff(async(tcp://securityonion:5644)): read tcp 172.17.0.22:32900->172.xx.xxxx.xxx5:5644: read: connection reset by peer
2022-01-04T14:21:32.092Z	ERROR	[publisher_pipeline_output]	pipeline/output.go:154	Failed to connect to backoff(async(tcp://securityonion:5644)): read tcp 172.17.0.22:32916->172.xx.xxxx.xxx5:5644: read: connection reset by peer
2022-01-04T14:21:46.192Z	ERROR	[publisher_pipeline_output]	pipeline/output.go:154	Failed to connect to backoff(async(tcp://securityonion:5644)): dial tcp 172.xx.xxxx.xxx5:5644: connect: connection refused
2022-01-04T14:22:06.042Z	ERROR	[publisher_pipeline_output]	pipeline/output.go:154	Failed to connect to backoff(async(tcp://securityonion:5644)): read tcp 172.17.0.22:33090->172.xx.xxxx.xxx5:5644: read: connection reset by peer

```

**Comment by Phillip-Samson** [comment, marked as answer]
after building a dev box and getting this to work I then reimaged the prod box. had the same issue and found out that i placed the filebeat init in the root of local/filebeat instead of the etc folder 
once I placed the init file in the local/filebeat/etc folder everything started working in prod
