### DISCUSSION TITLE
[2.2] Trouble with installing osquery (adding a host to Kolide Fleet)

### DISCUSSION THREAD

**Discussion by OverlordShin** [Security-Onion-Solutions/securityonion#1540] [Unsupported Versions]
Ok so I just installed Hybrid Hunter 2.2 in standalone via ISO. (Fully verified)

My issue is that I've installed the launcher MSI and flags (from the Downloads section on my instance) on my Windows Server (2019 DC) but the host isn't showing on Kolide even with the correct secret and flags. I have also made sure the Windows Server has access by allowing the osquery rule with so-allow

I've tried looking at the documentation but it doesn't really say anything about how to add a host on Fleet. (Or is it just me not reading properly?)

(The firewall on Windows Server is disabled also)

so-status reported with all greens.

salt-call state.highstate output:
```
[WARNING ] State for file: /etc/pki/ca.crt - Neither 'source' nor 'contents' nor 'contents_pillar' nor 'contents_grains' was defined, yet 'replace' was set to 'True'. As there is no source to replace the file with, 'replace' has been set to 'False' to avoid reading the file unnecessarily.

[WARNING ] State for file: /etc/pki/ca.crt - Neither 'source' nor 'contents' nor 'contents_pillar' nor 'contents_grains' was defined, yet 'replace' was set to 'True'. As there is no source to replace the file with, 'replace' has been set to 'False' to avoid reading the file unnecessarily.
```

**Comment by TOoSmOotH** [comment]
Those warnings are unrelated. Do you see the osquery process running on the Windows server? Is it trying to reach out to the fleet server? You can run `sudo tcpdump -ni <mgmntnic> host <windowsserverip>` and see if it is attempting to access it.

**Reply by OverlordShin** [reply]
I do see the osquery process running yes.
As for the tcpdump command, here was the output:
```
listening on ens33, link-type EN10MB (Ethernet), capture size 262144 bytes
00:28:13.954373 IP 192.168.1.50.51585 > 192.168.1.64.8090: Flags [.], seq 1424826984:1424826985, ack 393227626, win 8211, length 1
00:28:13.954474 IP 192.168.1.64.8090 > 192.168.1.50.51585: Flags [.], ack 1, win 237, options [nop,nop,sack 1 {0:1}], length 0
00:28:26.078777 IP 192.168.1.50.51585 > 192.168.1.64.8090: Flags [P.], seq 1:32, ack 1, win 8211, length 31
00:28:26.078915 IP 192.168.1.64.8090 > 192.168.1.50.51585: Flags [.], ack 32, win 237, length 0
00:28:26.079062 IP 192.168.1.64.8090 > 192.168.1.50.51585: Flags [F.], seq 1, ack 32, win 237, length 0
00:28:26.079511 IP 192.168.1.50.51585 > 192.168.1.64.8090: Flags [.], ack 2, win 8211, length 0
00:28:26.082855 IP 192.168.1.50.51585 > 192.168.1.64.8090: Flags [F.], seq 32, ack 2, win 8211, length 0
00:28:26.083001 IP 192.168.1.64.8090 > 192.168.1.50.51585: Flags [.], ack 33, win 237, length 0
```
It does seem they're talking, but Fleet isn't picking it up...

**Comment by OverlordShin** [comment]
Any updates on this?

**Reply by TOoSmOotH** [reply]
@OverlordShin Please keep in mind that community support is best effort and has no SLAs. We do provide paid support if you require faster response. Details can be found at https://securityonionsolutions.com/support 

With that being said any reason why you are not using 2.3? You can look at /opt/so/log/fleet/status.log to see what fleet is seeing from a log perspective.

**Reply by OverlordShin** [reply]
I thought I downloaded 2.3 but apparently it was 2.2 for some weird reason.
I'll try 2.3 and see if the issue persists.

**Reply by defensivedepth** [reply]
To be clear, you shouldn't need to do anything with the flags file for the MSI. The needed config in the flags file is already embedded in the MSI.  

Also, if you are accessing the Security Onion Console with the hostname instead of IP, make sure that the system you are installing the MSI on can resolve that hostname.

**Reply by OverlordShin** [reply]
Just installed and verified 2.3, I'm also accessing the console via IP.
However issue still persists, same result from tcpdump.

They do talk to each other, but as for Fleet it's just sitting there since I checked status.log and nothing is showing...

(I also reinstalled the MSI on my Windows Server)

**Reply by defensivedepth** [reply]
Each Fleet install generates a unique pre-shared secret (called the enroll secret). Reinstalling the MSI more than likely did not wipe out the previous install's configuration, which includes that enroll secret. You will need to uninstall the MSI, delete the Kolide folder under Program Files, and then reinstall the new MSI. 

osquery logs to the Applications channel in the Windows Eventlog - check that for indications of what is going on. It will log connection errors, etc there.

Finally - can you confirm that the SO Standalone node itself is enrolled successfully in Fleet and that you can Live Query it?

**Reply by OverlordShin** [reply]
I did uninstall the MSI and delete the associated folders, however that didn't work.
As for the event logs,I get this:
`caller=level.go:63 level=info caller=extension.go:136 msg="extension interrupted" err="enrolling host: query enrollment details, (even with retries): done trying: query enrollment details: could not query the extension manager client: write field stop error: The pipe is being closed."`

And I can confirm that the Standalone node is enrolled successfully and I'm able to run queries on the node itself.

On another note, I just installed the launcher on a Linux VM and it works perfectly!
Windows really gets on my nerves sometimes lol

But I'm still not sure why Windows isn't liking it, I've run so-allow and disabled the Windows firewall. But still no luck...

**Reply by Wilk4013** [reply]
I had a similar issue where it seemed like the .msi file that I downloaded from my standalone SO 2.3 installed but when I looked in services, it did not show up. I downloaded the osquery .msi (4.4.0) from the Osquery download site and ran it. I rebooted and saw osqueryd in my running services. I then right clicked on the .msi from the Security Onion download page and ran it in repair mode. I rebooted again (may not have been needed) and refreshed the Fleet manager browser page and I then saw my Windows 10 host showing in the Fleet Hosts section. I was able to perform queries at that point. Don't know if that will resolve your issue but it worked for me.

**Reply by defensivedepth** [reply]
hmmmm. I will look into this further.

@Wilk4013 FYI - SO does not use the stock osquery MSI, but Kolide Launcher (https://www.kolide.com/launcher/), which is a wrapper around osquery and allows for auto-updates, etc.

**Reply by Wilk4013** [reply]
@defensivedepth thank you for clarifying. That was my thought process around installing the stock msi and then using the repair feature to install the SO launcher. Lucky outcome for me.

**Reply by jtgreen-cse** [reply]
> `caller=level.go:63 level=info caller=extension.go:136 msg="extension interrupted" err="enrolling host: query enrollment details, (even with retries): done trying: query enrollment details: could not query the extension manager client: write field stop error: The pipe is being closed."`

I'm also seeing this. 8090 traffic makes to fleet, seeing the above in Windows Application Events for launcher. The same msi worked fine on another Windows host.

**Reply by jtgreen-cse** [reply]
With debug true:

```
caller=level.go:63 level=debug msg="runLauncher exited" err="run service: enrolling host: query enrollment details, (even with retries): done trying: query enrollment details: could not query the extension manager client: The pipe is being closed." stack="The pipe is being closed.
could not query the extension manager client
github.com/kolide/launcher/pkg/osquery/runtime.(*OsqueryInstance).Query
	/Users/seph/go/src/github.com/kolide/launcher/pkg/osquery/runtime/runtime.go:756
github.com/kolide/launcher/pkg/osquery/runtime.(*Runner).Query
	/Users/seph/go/src/github.com/kolide/launcher/pkg/osquery/runtime/runtime.go:40
github.com/kolide/launcher/pkg/osquery.getEnrollDetails
	/Users/seph/go/src/github.com/kolide/launcher/pkg/osquery/extension.go:805
github.com/kolide/launcher/pkg/osquery.(*Extension).Enroll.func1
	/Users/seph/go/src/github.com/kolide/launcher/pkg/osquery/extension.go:329
github.com/kolide/launcher/pkg/backoff.(*Backoff).try
	/Users/seph/go/src/github.com/kolide/launcher/pkg/backoff/backoff.go:48
github.com/kolide/launcher/pkg/backoff.(*Backoff).try
	/Users/seph/go/src/github.com/kolide/launcher/pkg/backoff/backoff.go:58
github.com/kolide/launcher/pkg/backoff.(*Backoff).try
	/Users/seph/go/src/github.com/kolide/launcher/pkg/backoff/backoff.go:58
github.com/kolide/launcher/pkg/backoff.(*Backoff).try
	/Users/seph/go/src/github.com/kolide/launcher/pkg/backoff/backoff.go:58
github.com/kolide/launcher/pkg/backoff.(*Backoff).try
	/Users/seph/go/src/github.com/kolide/launcher/pkg/backoff/backoff.go:58
github.com/kolide/launcher/pkg/backoff.(*Backoff).try
	/Users/seph/go/src/github.com/kolide/launcher/pkg/backoff/backoff.go:58
github.com/kolide/launcher/pkg/backoff.(*Backoff).try
	/Users/seph/go/src/github.com/kolide/launcher/pkg/backoff/backoff.go:58
github.com/kolide/launcher/pkg/backoff.(*Backoff).try
	/Users/seph/go/src/github.com/kolide/launcher/pkg/backoff/backoff.go:58
github.com/kolide/launcher/pkg/backoff.(*Backoff).try
	/Users/seph/go/src/github.com/kolide/launcher/pkg/backoff/backoff.go:58
github.com/kolide/launcher/pkg/backoff.(*Backoff).try
	/Users/seph/go/src/github.com/kolide/launcher/pkg/backoff/backoff.go:58
github.com/kolide/launcher/pkg/backoff.(*Backoff).Run
	/Users/seph/go/src/github.com/kolide/launcher/pkg/backoff/backoff.go:43
github.com/kolide/launcher/pkg/osquery.(*Extension).Enroll
	/Users/seph/go/src/github.com/kolide/launcher/pkg/osquery/extension.go:328
main.createExtensionRuntime.func2
	/Users/seph/go/src/github.com/kolide/launcher/cmd/launcher/extension.go:117
github.com/oklog/run.(*Group).Run.func1
	/Users/seph/go/pkg/mod/github.com/oklog/run@v1.0.0/group.go:38
runtime.goexit
	/usr/local/Cellar/go/1.13.4/libexec/src/runtime/asm_amd64.s:1357
query enrollment details
github.com/kolide/launcher/pkg/osquery.getEnrollDetails
	/Users/seph/go/src/github.com/kolide/launcher/pkg/osquery/extension.go:807
github.com/kolide/launcher/pkg/osquery.(*Extension).Enroll.func1
	/Users/seph/go/src/github.com/kolide/launcher/pkg/osquery/extension.go:329
github.com/kolide/launcher/pkg/backoff.(*Backoff).try
	/Users/seph/go/src/github.com/kolide/launcher/pkg/backoff/backoff.go:48
github.com/kolide/launcher/pkg/backoff.(*Backoff).try
	/Users/seph/go/src/github.com/kolide/launcher/pkg/backoff/backoff.go:58
github.com/kolide/launcher/pkg/backoff.(*Backoff).try
	/Users/seph/go/src/github.com/kolide/launcher/pkg/backoff/backoff.go:58
github.com/kolide/launcher/pkg/backoff.(*Backoff).try
	/Users/seph/go/src/github.com/kolide/launcher/pkg/backoff/backoff.go:58
github.com/kolide/launcher/pkg/backoff.(*Backoff).try
	/Users/seph/go/src/github.com/kolide/launcher/pkg/backoff/backoff.go:58
github.com/kolide/launcher/pkg/backoff.(*Backoff).try
	/Users/seph/go/src/github.com/kolide/launcher/pkg/backoff/backoff.go:58
github.com/kolide/launcher/pkg/backoff.(*Backoff).try
	/Users/seph/go/src/github.com/kolide/launcher/pkg/backoff/backoff.go:58
github.com/kolide/launcher/pkg/backoff.(*Backoff).try
	/Users/seph/go/src/github.com/kolide/launcher/pkg/backoff/backoff.go:58
github.com/kolide/launcher/pkg/backoff.(*Backoff).try
	/Users/seph/go/src/github.com/kolide/launcher/pkg/backoff/backoff.go:58
github.com/kolide/launcher/pkg/backoff.(*Backoff).try
	/Users/seph/go/src/github.com/kolide/launcher/pkg/backoff/backoff.go:58
github.com/kolide/launcher/pkg/backoff.(*Backoff).Run
	/Users/seph/go/src/github.com/kolide/launcher/pkg/backoff/backoff.go:43
github.com/kolide/launcher/pkg/osquery.(*Extension).Enroll
	/Users/seph/go/src/github.com/kolide/launcher/pkg/osquery/extension.go:328
main.createExtensionRuntime.func2
	/Users/seph/go/src/github.com/kolide/launcher/cmd/launcher/extension.go:117
github.com/oklog/run.(*Group).Run.func1
	/Users/seph/go/pkg/mod/github.com/oklog/run@v1.0.0/group.go:38
runtime.goexit
	/usr/local/Cellar/go/1.13.4/libexec/src/runtime/asm_amd64.s:1357
done trying
github.com/kolide/launcher/pkg/backoff.(*Backoff).try
	/Users/seph/go/src/github.com/kolide/launcher/pkg/backoff/backoff.go:51
github.com/kolide/launcher/pkg/backoff.(*Backoff).try
	/Users/seph/go/src/github.com/kolide/launcher/pkg/backoff/backoff.go:58
github.com/kolide/launcher/pkg/backoff.(*Backoff).try
	/Users/seph/go/src/github.com/kolide/launcher/pkg/backoff/backoff.go:58
github.com/kolide/launcher/pkg/backoff.(*Backoff).try
	/Users/seph/go/src/github.com/kolide/launcher/pkg/backoff/backoff.go:58
github.com/kolide/launcher/pkg/backoff.(*Backoff).try
	/Users/seph/go/src/github.com/kolide/launcher/pkg/backoff/backoff.go:58
github.com/kolide/launcher/pkg/backoff.(*Backoff).try
	/Users/seph/go/src/github.com/kolide/launcher/pkg/backoff/backoff.go:58
github.com/kolide/launcher/pkg/backoff.(*Backoff).try
	/Users/seph/go/src/github.com/kolide/launcher/pkg/backoff/backoff.go:58
github.com/kolide/launcher/pkg/backoff.(*Backoff).try
	/Users/seph/go/src/github.com/kolide/launcher/pkg/backoff/backoff.go:58
github.com/kolide/launcher/pkg/backoff.(*Backoff).try
	/Users/seph/go/src/github.com/kolide/launcher/pkg/backoff/backoff.go:58
github.com/kolide/launcher/pkg/backoff.(*Backoff).try
	/Users/seph/go/src/github.com/kolide/launcher/pkg/backoff/backoff.go:58
github.com/kolide/launcher/pkg/backoff.(*Backoff).Run
	/Users/seph/go/src/github.com/kolide/launcher/pkg/backoff/backoff.go:43
github.com/kolide/launcher/pkg/osquery.(*Extension).Enroll
	/Users/seph/go/src/github.com/kolide/launcher/pkg/osquery/extension.go:328
main.createExtensionRuntime.func2
	/Users/seph/go/src/github.com/kolide/launcher/cmd/launcher/extension.go:117
github.com/oklog/run.(*Group).Run.func1
	/Users/seph/go/pkg/mod/github.com/oklog/run@v1.0.0/group.go:38
runtime.goexit
	/usr/local/Cellar/go/1.13.4/libexec/src/runtime/asm_amd64.s:1357
query enrollment details, (even with retries)
github.com/kolide/launcher/pkg/osquery.(*Extension).Enroll
	/Users/seph/go/src/github.com/kolide/launcher/pkg/osquery/extension.go:332
main.createExtensionRuntime.func2
	/Users/seph/go/src/github.com/kolide/launcher/cmd/launcher/extension.go:117
github.com/oklog/run.(*Group).Run.func1
	/Users/seph/go/pkg/mod/github.com/oklog/run@v1.0.0/group.go:38
runtime.goexit
	/usr/local/Cellar/go/1.13.4/libexec/src/runtime/asm_amd64.s:1357
enrolling host
main.createExtensionRuntime.func2
	/Users/seph/go/src/github.com/kolide/launcher/cmd/launcher/extension.go:119
github.com/oklog/run.(*Group).Run.func1
	/Users/seph/go/pkg/mod/github.com/oklog/run@v1.0.0/group.go:38
runtime.goexit
	/usr/local/Cellar/go/1.13.4/libexec/src/runtime/asm_amd64.s:1357
run service
main.runLauncher
	/Users/seph/go/src/github.com/kolide/launcher/cmd/launcher/launcher.go:216
main.(*winSvc).Execute.func1
	/Users/seph/go/src/github.com/kolide/launcher/cmd/launcher/svc_windows.go:108
runtime.goexit
	/usr/local/Cellar/go/1.13.4/libexec/src/runtime/asm_amd64.s:1357" 
```

**Reply by OverlordShin** [reply]
> I had a similar issue where it seemed like the .msi file that I downloaded from my standalone SO 2.3 installed but when I looked in services, it did not show up. I downloaded the osquery .msi (4.4.0) from the Osquery download site and ran it. I rebooted and saw osqueryd in my running services. I then right clicked on the .msi from the Security Onion download page and ran it in repair mode. I rebooted again (may not have been needed) and refreshed the Fleet manager browser page and I then saw my Windows 10 host showing in the Fleet Hosts section. I was able to perform queries at that point. Don't know if that will resolve your issue but it worked for me.

Just tried that, however still no luck :(

**Reply by defensivedepth** [reply]
@OverlordShin What version of Windows Server have you tried this on? Just 2019? And was the server Airgapped?

**Reply by OverlordShin** [reply]
I'm using Windows Server 2019 (build 17763)
And no, the server isn't Airgapped. It's running on the same network as SO.

**Reply by defensivedepth** [reply]
@OverlordShin Please run the following on the Windows server and post the (sanitized) logs somewhere:

`"C:\Program Files\Kolide\Launcher-so-launcher\bin\launcher.exe" --config "C:\Program Files\Kolide\Launcher-so-launcher\conf\launcher.flags" --osquery_verbose --debug`

**Reply by OverlordShin** [reply]
Here is the output:

https://pastebin.com/raw/t4zR17V1

**Reply by innovate-support** [reply]
I have the same problems with installing osquery on Win10.  Tried all sorts of things but nothing seems to make a difference.  I ran the debug command and saw a bunch of 'Access is denied' warnings similar to this.
"open launcher db: open C:\\Program Files\\Kolide\\Launcher-so-launcher\\data\\launcher.db: Access is denied."

**Reply by Xboarder56** [reply]
Not exactly the same but getting a certificate error with the agent. 

{"caller":"main.go:30","msg":"Launcher starting up","revision":"6c02d75899332992814dbcd9b1cad37c41113f86","severity":"info","ts":"2021-03-30T03:20:24.8367547Z","version":"0.11.14"}
{"caller":"main.go:30","msg":"Launcher starting up","revision":"e1a902738ab2bc41429e2d768a086f001bcac356","severity":"info","ts":"2021-03-30T03:20:24.8947986Z","version":"0.11.19"}
{"caller":"launcher.go:37","msg":"runLauncher starting","severity":"debug","ts":"2021-03-30T03:20:24.895778Z"}
{"caller":"client_grpc.go:111","cert_pinning":false,"msg":"dialing grpc server","server":"so.securityonion.org:8090","severity":"info","tls_secure":true,"transport_secure":true,"ts":"2021-03-30T03:20:24.897762Z"}
{"build":"e1a902738ab2bc41429e2d768a086f001bcac356","caller":"launcher.go:155","msg":"started kolide launcher","severity":"info","ts":"2021-03-30T03:20:24.9042109Z","version":"0.11.19"}
{"binaryName":"osqueryd.exe","caller":"autoupdate.go:156","msg":"Created Updater","severity":"debug","stagingPath":"C:\\Program Files\\Kolide\\Launcher-so-launcher\\data\\osqueryd.exe-staging","ts":"2021-03-30T03:20:24.9062203Z","updatesDirectory":"C:\\Program Files\\Kolide\\Launcher-so-launcher\\bin\\osqueryd.exe-updates"}
{"binaryName":"launcher.exe","caller":"autoupdate.go:156","msg":"Created Updater","severity":"debug","stagingPath":"C:\\Program Files\\Kolide\\Launcher-so-launcher\\data\\launcher.exe-staging","ts":"2021-03-30T03:20:24.9086739Z","updatesDirectory":"C:\\Program Files\\Kolide\\Launcher-so-launcher\\bin\\launcher.exe-updates"}
{"caller":"query_target_updater.go:21","msg":"query target updater started","severity":"info","ts":"2021-03-30T03:20:24.9086739Z"}
{"arg0":"C:\\Program Files\\Kolide\\Launcher-so-launcher\\bin\\osqueryd.exe-updates\\1617073900\\osqueryd.exe","args":"C:\\Program Files\\Kolide\\Launcher-so-launcher\\bin\\osqueryd.exe-updates\\1617073900\\osqueryd.exe --logger_plugin=kolide_grpc --distributed_plugin=kolide_grpc --disable_distributed=false --distributed_interval=5 --pack_delimiter=: --host_identifier=uuid --force=true --disable_watchdog --utc --verbose --config_refresh=300 --config_accelerated_refresh=30 --allow_unsafe --windows_event_channels=System,Application,Security,Microsoft-Windows-Sysmon/Operational --pidfile=C:\\Program Files\\Kolide\\Launcher-so-launcher\\data\\osquery.pid --database_path=C:\\Program Files\\Kolide\\Launcher-so-launcher\\data\\osquery.db --extensions_socket=\\\\.\\pipe\\kolide-osquery-01F20JB32C1Z0YSHG3ETXZY9TD --extensions_autoload=C:\\Program Files\\Kolide\\Launcher-so-launcher\\data\\osquery.autoload --extensions_timeout=10 --config_plugin=kolide_grpc","caller":"runtime.go:610","msg":"launching osqueryd","severity":"info","ts":"2021-03-30T03:20:24.9632343Z"}
{"caller":"init.cpp:342","component":"osquery","level":"stderr","msg":"I0329 20:20:24.994482 22992 init.cpp:342] osquery initialized [version=4.7.0]","severity":"info","ts":"2021-03-30T03:20:24.9963532Z"}
{"caller":"system.cpp:342","component":"osquery","level":"stderr","msg":"I0329 20:20:25.015808 22992 system.cpp:342] Found stale process for osqueryd (22752)","severity":"info","ts":"2021-03-30T03:20:25.0160315Z"}
{"caller":"system.cpp:374","component":"osquery","level":"stderr","msg":"I0329 20:20:25.016305 22992 system.cpp:374] Writing osqueryd pid (23836) to C:\\Program Files\\Kolide\\Launcher-so-launcher\\data\\osquery.pid","severity":"info","ts":"2021-03-30T03:20:25.0163062Z"}
{"caller":"extensions.cpp:438","component":"osquery","level":"stderr","msg":"I0329 20:20:25.020807 22992 extensions.cpp:438] Found autoloadable extension: C:\\Program Files\\Kolide\\Launcher-so-launcher\\bin\\osquery-extension.exe","severity":"info","ts":"2021-03-30T03:20:25.0208087Z"}
{"caller":"dispatcher.cpp:78","component":"osquery","level":"stderr","msg":"I0329 20:20:25.021265 22992 dispatcher.cpp:78] Adding new service: WatcherRunner (00000281330428D0) to thread: 12864 (0000028134DEF480) in process 23836","severity":"info","ts":"2021-03-30T03:20:25.0217774Z"}
{"caller":"rocksdb.cpp:132","component":"osquery","level":"stderr","msg":"I0329 20:20:25.022258 22992 rocksdb.cpp:132] Opening RocksDB handle: C:\\Program Files\\Kolide\\Launcher-so-launcher\\data\\osquery.db","severity":"info","ts":"2021-03-30T03:20:25.0222591Z"}
{"caller":"watcher.cpp:659","component":"osquery","level":"stderr","msg":"I0329 20:20:25.034658 12864 watcher.cpp:659] Created and monitoring extension child (18484): C:\\Program Files\\Kolide\\Launcher-so-launcher\\bin\\osquery-extension.exe","severity":"info","ts":"2021-03-30T03:20:25.0347689Z"}
{"caller":"","component":"osquery","level":"stderr","msg":"[C:\\Program Files\\Kolide\\Launcher-so-launcher\\bin\\osquery-extension.exe --verbose --socket \\\\.\\pipe\\kolide-osquery-01F20JB32C1Z0YSHG3ETXZY9TD --timeout 10 --interval 3]","severity":"info","ts":"2021-03-30T03:20:25.0498414Z"}
{"caller":"dispatcher.cpp:78","component":"osquery","level":"stderr","msg":"I0329 20:20:25.090209 22992 dispatcher.cpp:78] Adding new service: ExtensionWatcher (0000028134DE9790) to thread: 16192 (0000028134E5BEC0) in process 23836","severity":"info","ts":"2021-03-30T03:20:25.09021Z"}
{"caller":"dispatcher.cpp:78","component":"osquery","level":"stderr","msg":"I0329 20:20:25.090549 22992 dispatcher.cpp:78] Adding new service: ExtensionRunnerCore (0000028134DC7D30) to thread: 22408 (0000028134E5C020) in process 23836\r\nI0329 20:20:25.090549 22408 interface.cpp:270] Extension manager service starting: \\\\.\\pipe\\kolide-osquery-01F20JB32C1Z0YSHG3ETXZY9TD","severity":"info","ts":"2021-03-30T03:20:25.0905504Z"}
{"caller":"interface.cpp:110","component":"osquery","level":"stderr","msg":"I0329 20:20:25.198833 16120 interface.cpp:110] Registering extension (kolide, 3690, version=, sdk=)","severity":"info","ts":"2021-03-30T03:20:25.1988348Z"}
{"caller":"registry_factory.cpp:107","component":"osquery","level":"stderr","msg":"I0329 20:20:25.198833 16120 registry_factory.cpp:107] Extension 3690 registered config plugin kolide_grpc\r\nI0329 20:20:25.198833 16120 registry_factory.cpp:107] Extension 3690 registered distributed plugin kolide_grpc\r\nI0329 20:20:25.198833 16120 registry_factory.cpp:107] Extension 3690 registered logger plugin kolide_grpc","severity":"info","ts":"2021-03-30T03:20:25.1988348Z"}
{"caller":"request_enrollment.go:207","enrollSecret":"bhmaaXUdknrEY4yW5wJnLP6w6NZL8PQZ","err":"rpc error: code = Unavailable desc = all SubConns are in TransientFailure, latest connection error: connection error: desc = \"transport: authentication handshake failed: x509: certificate signed by unknown authority\"","hostIdentifier":"60464683-9eff-4e87-bcc3-957dc0a835fd","method":"RequestEnrollment","nodekey":"","reauth":false,"severity":"info","took":"0s","ts":"2021-03-30T03:20:26.3014938Z","uuid":"7c61aff2-247b-4245-9f9b-9c6fd5bae63a"}
{"caller":"launcher.go:122","err":"enrolling host: transport error in enrollment: rpc error: code = Unavailable desc = all SubConns are in TransientFailure, latest connection error: connection error: desc = \"transport: authentication handshake failed: x509: certificate signed by unknown authority\"","msg":"interrupted","severity":"info","ts":"2021-03-30T03:20:26.3019524Z"}
{"caller":"launcher.go:123","err":"enrolling host: transport error in enrollment: rpc error: code = Unavailable desc = all SubConns are in TransientFailure, latest connection error: connection error: desc = \"transport: authentication handshake failed: x509: certificate signed by unknown authority\"","msg":"interrupted","severity":"debug","stack":"rpc error: code = Unavailable desc = all SubConns are in TransientFailure, latest connection error: connection error: desc = \"transport: authentication handshake failed: x509: certificate signed by unknown authority\"\ntransport error in enrollment\ngithub.com/kolide/launcher/pkg/osquery.(*Extension).Enroll\n\t/Users/seph/checkouts/kolide/launcher/pkg/osquery/extension.go:341\nmain.createExtensionRuntime.func2\n\t/Users/seph/checkouts/kolide/launcher/cmd/launcher/extension.go:127\ngithub.com/oklog/run.(*Group).Run.func1\n\t/Users/seph/go/pkg/mod/github.com/oklog/run@v1.0.0/group.go:38\nruntime.goexit\n\t/opt/go1.16beta1.darwin-amd64/go/src/runtime/asm_amd64.s:1367\nenrolling host\nmain.createExtensionRuntime.func2\n\t/Users/seph/checkouts/kolide/launcher/cmd/launcher/extension.go:129\ngithub.com/oklog/run.(*Group).Run.func1\n\t/Users/seph/go/pkg/mod/github.com/oklog/run@v1.0.0/group.go:38\nruntime.goexit\n\t/opt/go1.16beta1.darwin-amd64/go/src/runtime/asm_amd64.s:1367","ts":"2021-03-30T03:20:26.302937Z"}
{"caller":"query_target_updater.go:26","msg":"query target updater interrupted","severity":"info","ts":"2021-03-30T03:20:26.3034337Z"}
{"caller":"launcher.go:118","msg":"beginnning shutdown via signal","severity":"info","ts":"2021-03-30T03:20:26.3034337Z"}
{"caller":"extension.go:146","err":"enrolling host: transport error in enrollment: rpc error: code = Unavailable desc = all SubConns are in TransientFailure, latest connection error: connection error: desc = \"transport: authentication handshake failed: x509: certificate signed by unknown authority\"","msg":"extension interrupted","severity":"info","ts":"2021-03-30T03:20:26.3034337Z"}
{"caller":"extension.go:147","err":"enrolling host: transport error in enrollment: rpc error: code = Unavailable desc = all SubConns are in TransientFailure, latest connection error: connection error: desc = \"transport: authentication handshake failed: x509: certificate signed by unknown authority\"","msg":"extension interrupted","severity":"debug","stack":"rpc error: code = Unavailable desc = all SubConns are in TransientFailure, latest connection error: connection error: desc = \"transport: authentication handshake failed: x509: certificate signed by unknown authority\"\ntransport error in enrollment\ngithub.com/kolide/launcher/pkg/osquery.(*Extension).Enroll\n\t/Users/seph/checkouts/kolide/launcher/pkg/osquery/extension.go:341\nmain.createExtensionRuntime.func2\n\t/Users/seph/checkouts/kolide/launcher/cmd/launcher/extension.go:127\ngithub.com/oklog/run.(*Group).Run.func1\n\t/Users/seph/go/pkg/mod/github.com/oklog/run@v1.0.0/group.go:38\nruntime.goexit\n\t/opt/go1.16beta1.darwin-amd64/go/src/runtime/asm_amd64.s:1367\nenrolling host\nmain.createExtensionRuntime.func2\n\t/Users/seph/checkouts/kolide/launcher/cmd/launcher/extension.go:129\ngithub.com/oklog/run.(*Group).Run.func1\n\t/Users/seph/go/pkg/mod/github.com/oklog/run@v1.0.0/group.go:38\nruntime.goexit\n\t/opt/go1.16beta1.darwin-amd64/go/src/runtime/asm_amd64.s:1367","ts":"2021-03-30T03:20:26.3039303Z"}
{"caller":"registry_factory.cpp:107","component":"osquery","level":"stderr","msg":"I0329 20:20:26.307401 16120 registry_factory.cpp:107] Extension 3690 registered table plugin kolide_best_practices","severity":"info","ts":"2021-03-30T03:20:26.3074023Z"}
{"caller":"registry_factory.cpp:107","component":"osquery","level":"stderr","msg":"I0329 20:20:26.307401 16120 registry_factory.cpp:107] Extension 3690 registered table plugin kolide_chrome_login_data_emails\r\nI0329 20:20:26.307401 16120 registry_factory.cpp:107] Extension 3690 registered table plugin kolide_chrome_user_profiles\r\nI0329 20:20:26.307401 16120 registry_factory.cpp:107] Extension 3690 registered table plugin kolide_dsim_default_associations\r\nI0329 20:20:26.307401 16120 registry_factory.cpp:107] Extension 3690 registered table plugin kolide_email_addresses\r\nI0329 20:20:26.307401 16120 registry_factory.cpp:107] Extension 3690 registered table plugin kolide_ini\r\nI0329 20:20:26.307401 16120 registry_factory.cpp:107] Extension 3690 registered table plugin kolide_json\r\nI0329 20:20:26.307401 16120 registry_factory.cpp:107] Extension 3690 registered table plugin kolide_keyinfo\r\nI0329 20:20:26.307401 16120 registry_factory.cpp:107] Extension 3690 registered table plugin kolide_launcher_autoupdate_config\r\nI0329 20:20:26.307401 16120 registry_factory.cpp:107] Extension 3690 registered table plugin kolide_launcher_config\r\nI0329 20:20:26.307401 16120 registry_factory.cpp:107] Extension 3690 registered table plugin kolide_launcher_identifier\r\nI0329 20:20:26.307401 16120 registry_factory.cpp:107] Extension 3690 registered table plugin kolide_launcher_info\r\nI0329 20:20:26.307401 16120 registry_factory.cpp:107] Extension 3690 registered table plugin kolide_onepassword_accounts\r\nI0329 20:20:26.307401 16120 registry_factory.cpp:107] Extension 3690 registered table plugin kolide_plist\r\nI0329 20:20:26.307401 16120 registry_factory.cpp:107] Extension 3690 registered table plugin kolide_program_icons\r\nI0329 20:20:26.307401 16120 registry_factory.cpp:107] Extension 3690 registered table plugin kolide_secedit\r\nI0329 20:20:26.307401 16120 registry_factory.cpp:107] Extension 3690 registered table plugin kolide_slack_config\r\nI0329 20:20:26.307401 16120 registry_factory.cpp:107] Extension 3690 registered table plugin kolide_ssh_keys\r\nI0329 20:20:26.307401 16120 registry_factory.cpp:107] Extension 3690 registered table plugin kolide_target_membership\r\nI0329 20:20:26.307401 16120 registry_factory.cpp:107] Extension 3690 registered table plugin kolide_wifi_networks","severity":"info","ts":"2021-03-30T03:20:26.3074023Z"}
{"caller":"registry_factory.cpp:107","component":"osquery","level":"stderr","msg":"I0329 20:20:26.307401 16120 registry_factory.cpp:107] Extension 3690 registered table plugin kolide_windows_update_history\r\nI0329 20:20:26.307401 16120 registry_factory.cpp:107] Extension 3690 registered table plugin kolide_windows_updates\r\nI0329 20:20:26.307401 16120 registry_factory.cpp:107] Extension 3690 registered table plugin kolide_wmi\r\nI0329 20:20:26.307401 16120 registry_factory.cpp:107] Extension 3690 registered table plugin kolide_xml\r\nI0329 20:20:26.307401 16120 registry_factory.cpp:107] Extension 3690 registered table plugin kolide_zerotier_info\r\nI0329 20:20:26.307401 16120 registry_factory.cpp:107] Extension 3690 registered table plugin kolide_zerotier_networks\r\nI0329 20:20:26.307401 16120 registry_factory.cpp:107] Extension 3690 registered table plugin kolide_zerotier_peers","severity":"info","ts":"2021-03-30T03:20:26.308393Z"}
{"caller":"runtime.go:649","err":"exit status 1","mode":"-rw-rw-rw-","msg":"Error running osquery command","path":"C:\\Program Files\\Kolide\\Launcher-so-launcher\\bin\\osqueryd.exe-updates\\1617073900\\osqueryd.exe","severity":"info","sha256":"9b2f3b75fb13f9447dbfd719d759650d2e82fc94d8ad4e9505e1114617f551ca","sizeBytes":21644960,"ts":"2021-03-30T03:20:26.4646546Z"}
{"caller":"updater.go:112","err":"enrolling host: transport error in enrollment: rpc error: code = Unavailable desc = all SubConns are in TransientFailure, latest connection error: connection error: desc = \"transport: authentication handshake failed: x509: certificate signed by unknown authority\"","msg":"updater interrupted","severity":"info","ts":"2021-03-30T03:20:26.4646546Z"}
{"caller":"updater.go:113","err":"enrolling host: transport error in enrollment: rpc error: code = Unavailable desc = all SubConns are in TransientFailure, latest connection error: connection error: desc = \"transport: authentication handshake failed: x509: certificate signed by unknown authority\"","msg":"updater interrupted","severity":"debug","stack":"rpc error: code = Unavailable desc = all SubConns are in TransientFailure, latest connection error: connection error: desc = \"transport: authentication handshake failed: x509: certificate signed by unknown authority\"\ntransport error in enrollment\ngithub.com/kolide/launcher/pkg/osquery.(*Extension).Enroll\n\t/Users/seph/checkouts/kolide/launcher/pkg/osquery/extension.go:341\nmain.createExtensionRuntime.func2\n\t/Users/seph/checkouts/kolide/launcher/cmd/launcher/extension.go:127\ngithub.com/oklog/run.(*Group).Run.func1\n\t/Users/seph/go/pkg/mod/github.com/oklog/run@v1.0.0/group.go:38\nruntime.goexit\n\t/opt/go1.16beta1.darwin-amd64/go/src/runtime/asm_amd64.s:1367\nenrolling host\nmain.createExtensionRuntime.func2\n\t/Users/seph/checkouts/kolide/launcher/cmd/launcher/extension.go:129\ngithub.com/oklog/run.(*Group).Run.func1\n\t/Users/seph/go/pkg/mod/github.com/oklog/run@v1.0.0/group.go:38\nruntime.goexit\n\t/opt/go1.16beta1.darwin-amd64/go/src/runtime/asm_amd64.s:1367","ts":"2021-03-30T03:20:26.4656973Z"}
{"caller":"updater.go:119","msg":"failed to send stop signal","severity":"debug","ts":"2021-03-30T03:20:26.4661429Z"}
{"caller":"updater.go:112","err":"enrolling host: transport error in enrollment: rpc error: code = Unavailable desc = all SubConns are in TransientFailure, latest connection error: connection error: desc = \"transport: authentication handshake failed: x509: certificate signed by unknown authority\"","msg":"updater interrupted","severity":"info","ts":"2021-03-30T03:20:26.4661429Z"}
{"caller":"updater.go:113","err":"enrolling host: transport error in enrollment: rpc error: code = Unavailable desc = all SubConns are in TransientFailure, latest connection error: connection error: desc = \"transport: authentication handshake failed: x509: certificate signed by unknown authority\"","msg":"updater interrupted","severity":"debug","stack":"rpc error: code = Unavailable desc = all SubConns are in TransientFailure, latest connection error: connection error: desc = \"transport: authentication handshake failed: x509: certificate signed by unknown authority\"\ntransport error in enrollment\ngithub.com/kolide/launcher/pkg/osquery.(*Extension).Enroll\n\t/Users/seph/checkouts/kolide/launcher/pkg/osquery/extension.go:341\nmain.createExtensionRuntime.func2\n\t/Users/seph/checkouts/kolide/launcher/cmd/launcher/extension.go:127\ngithub.com/oklog/run.(*Group).Run.func1\n\t/Users/seph/go/pkg/mod/github.com/oklog/run@v1.0.0/group.go:38\nruntime.goexit\n\t/opt/go1.16beta1.darwin-amd64/go/src/runtime/asm_amd64.s:1367\nenrolling host\nmain.createExtensionRuntime.func2\n\t/Users/seph/checkouts/kolide/launcher/cmd/launcher/extension.go:129\ngithub.com/oklog/run.(*Group).Run.func1\n\t/Users/seph/go/pkg/mod/github.com/oklog/run@v1.0.0/group.go:38\nruntime.goexit\n\t/opt/go1.16beta1.darwin-amd64/go/src/runtime/asm_amd64.s:1367","ts":"2021-03-30T03:20:26.4666657Z"}
{"caller":"updater.go:119","msg":"failed to send stop signal","severity":"debug","ts":"2021-03-30T03:20:26.4666657Z"}

**Reply by defensivedepth** [reply]
@Xboarder56 Please start a new discussion and make sure to list relevant troubleshooting information ie Install type (ISO or Network), Architecture, etc.
