### DISCUSSION TITLE
No alerts and no wazuh agent traffic after 8 day ISP network outage

### DISCUSSION THREAD

**Discussion by tanc7** [Security-Onion-Solutions/securityonion#7202] [Unsupported Versions] [answered]
**Internet access has been restored using a 5G Modem as a failover to my cable modem**
**Edit: Running TCPDump for UDP 1514 traffic on both my management interface and ZeroTier SDN interface does show that I am getting input from each of my agents however...**
**Running tcpdump on LAN interface shows it's receiving traffic from all LAN Wazuh Agents**
```
[root@securityo admin]# tcpdump -i eth0 udp port 1514
tcpdump: verbose output suppressed, use -v or -vv for full protocol decode
listening on eth0, link-type EN10MB (Ethernet), capture size 262144 bytes
22:45:14.815183 IP 192.168.1.14.38009 > securityo.fujitsu-dtcns: UDP, length 106
22:45:15.556836 IP 192.168.1.9.38907 > securityo.fujitsu-dtcns: UDP, length 90
22:45:17.196454 IP 192.168.1.48.49051 > securityo.fujitsu-dtcns: UDP, length 101
22:45:17.201553 IP 192.168.1.26.46232 > securityo.fujitsu-dtcns: UDP, length 85
22:45:17.444200 IP 192.168.1.13.59388 > securityo.fujitsu-dtcns: UDP, length 85
22:45:18.577745 IP 192.168.1.45.40746 > securityo.fujitsu-dtcns: UDP, length 101
22:45:19.816271 IP 192.168.1.14.56700 > securityo.fujitsu-dtcns: UDP, length 90
22:45:20.558425 IP 192.168.1.9.42670 > securityo.fujitsu-dtcns: UDP, length 90
22:45:22.197890 IP 192.168.1.48.51316 > securityo.fujitsu-dtcns: UDP, length 85
22:45:22.208158 IP 192.168.1.26.41045 > securityo.fujitsu-dtcns: UDP, length 85
22:45:22.445618 IP 192.168.1.13.52990 > securityo.fujitsu-dtcns: UDP, length 101
22:45:23.578908 IP 192.168.1.45.51504 > securityo.fujitsu-dtcns: UDP, length 101
```
**Running TCPDump on my ZeroTier interface shows it's receiving traffic from my cloud VPSes**
```
[root@securityo admin]# tcpdump -i ztc3q22xq4 udp port 1514
tcpdump: verbose output suppressed, use -v or -vv for full protocol decode
listening on ztc3q22xq4, link-type EN10MB (Ethernet), capture size 262144 bytes
22:45:52.614886 IP 172.22.137.41.55930 > securityo.fujitsu-dtcns: UDP, length 90
22:45:52.700939 IP 172.22.60.194.44843 > securityo.fujitsu-dtcns: UDP, length 90
22:45:53.275403 IP 172.22.144.246.43057 > securityo.fujitsu-dtcns: UDP, length 90
22:45:54.836898 IP 172.22.20.133.52087 > securityo.fujitsu-dtcns: UDP, length 90
22:45:57.665033 IP 172.22.137.41.48641 > securityo.fujitsu-dtcns: UDP, length 90
22:45:57.789009 IP 172.22.60.194.37334 > securityo.fujitsu-dtcns: UDP, length 90
22:45:58.305330 IP 172.22.144.246.42327 > securityo.fujitsu-dtcns: UDP, length 90
22:45:59.873096 IP 172.22.20.133.47177 > securityo.fujitsu-dtcns: UDP, length 90
```

**Looking at the logs on one of my agents shows this**

```
2022/02/15 14:26:10 ossec-agent: INFO: Trying to connect to server (192.168.1.33:1514/udp).
2022/02/15 14:27:15 ossec-agent: WARNING: (4101): Waiting for server reply (not started). Tried: '192.168.1.33'.
2022/02/15 14:27:15 ossec-agent: WARNING: Unable to connect to any server.
2022/02/15 14:27:15 ossec-agent: INFO: Closing connection to server (192.168.1.33:1514/udp).
2022/02/15 14:27:15 ossec-agent: INFO: Trying to connect to server (192.168.1.33:1514/udp).
```

**Attempting to run the agent manager turns up this**

```
[admin@securityo ~]$ sudo so-wazuh-agent-manage 
2022/02/15 06:29:03 manage_agents: CRITICAL: (1226): Error reading XML file '/var/ossec/etc/ossec.conf':  (line 0).
```
Also I cannot seem to see any alerts anymore.

Contents of XML file

```
<!--
  Wazuh - Agent Configuration
  More info at: https://documentation.wazuh.com
  Mailing list: https://groups.google.com/forum/#!forum/wazuh
-->

<ossec_config>
  <client>
    <server>
      <address>192.168.1.33</address>
      <port>1514</port>
      <protocol>udp</protocol>
    </server>
    <config-profile>centos, centos7</config-profile>
    <notify_time>10</notify_time>
    <time-reconnect>60</time-reconnect>
    <auto_restart>yes</auto_restart>
    <crypto_method>aes</crypto_method>
  </client>

  <client_buffer>
    <!-- Agent buffer options -->
    <disabled>no</disabled>
    <queue_size>5000</queue_size>
    <events_per_second>500</events_per_second>
  </client_buffer>

  <!-- Policy monitoring -->
  <rootcheck>
    <disabled>no</disabled>
    <check_unixaudit>yes</check_unixaudit>
    <check_files>yes</check_files>
    <check_trojans>yes</check_trojans>
    <check_dev>yes</check_dev>
    <check_sys>yes</check_sys>
    <check_pids>yes</check_pids>
    <check_ports>yes</check_ports>
    <check_if>yes</check_if>

    <!-- Frequency that rootcheck is executed - every 12 hours -->
    <frequency>43200</frequency>

    <rootkit_files>/var/ossec/etc/shared/rootkit_files.txt</rootkit_files>
    <rootkit_trojans>/var/ossec/etc/shared/rootkit_trojans.txt</rootkit_trojans>

    <system_audit>/var/ossec/etc/shared/system_audit_rcl.txt</system_audit>
    <system_audit>/var/ossec/etc/shared/system_audit_ssh.txt</system_audit>

    <skip_nfs>yes</skip_nfs>
  </rootcheck>

  <wodle name="open-scap">
    <disabled>yes</disabled>
    <timeout>1800</timeout>
    <interval>1d</interval>
    <scan-on-start>yes</scan-on-start>
  </wodle>

  <wodle name="cis-cat">
    <disabled>yes</disabled>
    <timeout>1800</timeout>
    <interval>1d</interval>
    <scan-on-start>yes</scan-on-start>

    <java_path>wodles/java</java_path>
    <ciscat_path>wodles/ciscat</ciscat_path>
  </wodle>

  <!-- Osquery integration -->
  <wodle name="osquery">
    <disabled>yes</disabled>
    <run_daemon>yes</run_daemon>
    <log_path>/var/log/osquery/osqueryd.results.log</log_path>
    <config_path>/etc/osquery/osquery.conf</config_path>
    <add_labels>yes</add_labels>
  </wodle>

  <!-- System inventory -->
  <wodle name="syscollector">
    <disabled>no</disabled>
    <interval>1h</interval>
    <scan_on_start>yes</scan_on_start>
    <hardware>yes</hardware>
    <os>yes</os>
    <network>yes</network>
    <packages>yes</packages>
    <ports all="no">yes</ports>
    <processes>yes</processes>
  </wodle>

  <!-- File integrity monitoring -->
  <syscheck>
    <disabled>no</disabled>

    <!-- Frequency that syscheck is executed default every 12 hours -->
    <frequency>43200</frequency>

    <scan_on_start>yes</scan_on_start>

    <!-- Directories to check  (perform all possible verifications) -->
    <directories check_all="yes">/etc,/usr/bin,/usr/sbin</directories>
    <directories check_all="yes">/bin,/sbin,/boot</directories>

    <!-- Files/directories to ignore -->
    <ignore>/etc/mtab</ignore>
    <ignore>/etc/hosts.deny</ignore>
    <ignore>/etc/mail/statistics</ignore>
    <ignore>/etc/random-seed</ignore>
    <ignore>/etc/random.seed</ignore>
    <ignore>/etc/adjtime</ignore>
    <ignore>/etc/httpd/logs</ignore>
    <ignore>/etc/utmpx</ignore>
    <ignore>/etc/wtmpx</ignore>
    <ignore>/etc/cups/certs</ignore>
    <ignore>/etc/dumpdates</ignore>
    <ignore>/etc/svc/volatile</ignore>
    <ignore>/sys/kernel/security</ignore>
    <ignore>/sys/kernel/debug</ignore>

    <!-- Check the file, but never compute the diff -->
    <nodiff>/etc/ssl/private.key</nodiff>

    <skip_nfs>yes</skip_nfs>

    <!-- Remove not monitored files -->
    <remove_old_diff>yes</remove_old_diff>

    <!-- Allow the system to restart Auditd after installing the plugin -->
    <restart_audit>yes</restart_audit>
  </syscheck>

  <!-- Log analysis -->
  <localfile>
    <log_format>command</log_format>
    <command>df -P</command>
    <frequency>360</frequency>
  </localfile>

  <localfile>
    <log_format>full_command</log_format>
    <command>netstat -tulpn | sed 's/\([[:alnum:]]\+\)\ \+[[:digit:]]\+\ \+[[:digit:]]\+\ \+\(.*\):\([[:digit:]]*\)\ \+\([0-9\.\:\*]\+\).\+\ \([[:digit:]]*\/[[:alnum:]\-]*\).*/\1 \2 == \3 == \4 \5/' | sort -k 4 -g | sed 's/ == \(.*\) ==/:\1/' | sed 1,2d</command>
    <alias>netstat listening ports</alias>
    <frequency>360</frequency>
  </localfile>

  <localfile>
    <log_format>full_command</log_format>
    <command>last -n 20</command>
    <frequency>360</frequency>
  </localfile>

  <!-- Active response -->
  <active-response>
    <disabled>no</disabled>
    <ca_store>/var/ossec/etc/wpk_root.pem</ca_store>
    <ca_verification>yes</ca_verification>
  </active-response>

  <!-- Choose between "plain", "json", or "plain,json" for the format of internal logs -->
  <logging>
    <log_format>plain</log_format>
  </logging>

</ossec_config>

<ossec_config>
  <localfile>
    <log_format>syslog</log_format>
    <location>/var/ossec/logs/active-responses.log</location>
  </localfile>
  <localfile>
    <log_format>syslog</log_format>
    <location>/var/log/secure</location>
  </localfile>
  <localfile>
    <log_format>syslog</log_format>
    <location>/var/log/syslog</location>
  </localfile>

  <localfile>
    <log_format>syslog</log_format>
    <location>/var/log/dpkg.log</location>
  </localfile>

  <localfile>
    <log_format>syslog</log_format>
    <location>/var/log/kern.log</location>
  </localfile>

</ossec_config>
```

Performed full upgrade with soup and still doesn't work. Manually monitoring traffic with Kibana still works however.

**Comment by dougburks** [comment, marked as answer]
> ```
> 2022/02/15 06:29:03 manage_agents: CRITICAL: (1226): Error reading XML file '/var/ossec/etc/ossec.conf':  (line 0).
> ```

This is most likely due to a bug in older versions where an xml header was incorrectly inserted into `/nsm/wazuh/etc/ossec.conf`.  Take a look at that file and see if the first line is an xml header like this:
```
<?xml version="1.0" ?>
```
If so, back up the file, remove that first line, and then restart Wazuh.

> Performed full upgrade with soup and still doesn't work.

Upgrading to the latest version should in theory correct the xml header issue above, but it's worth double checking.

**Reply by tanc7** [reply]
Hey you're right. I just checked the file and it has that unnecessary line right there. I just restarted wazuh and now I can manage my agents, but let me check if I am collecting log alerts from my cloud VPSes and LAN first.

**Comment by tanc7** [comment]
Thank you. The problem as been solved and I am getting alerts from both my LAN and my cloud VPSes. Now should I continue to use ZeroTier to monitor my cloud endpoints or should I switch over to a split-tunneled WireGuard Site-to-Site VPN by process and interface?

WireGuard would be faster and more secure, but harder to implement than ZeroTier I believe.

**Reply by dougburks** [reply]
WireGuard and ZeroTier are beyond the scope of this discussion site.
